{
 "schema": "abep_experiment_package_v1",
 "id": "fo_experiment_package_v1",
 "follow_on": "fo_experiment_package",
 "trigger": "T_EXPERIMENT_PACKAGE",
 "prerequisite": "lane_25_min_decisive_experiment",
 "status": "DRAFT_PENDING_OWNER",
 "base_commit": "d939ef66324b7d1036b2c9bcd5e7674df218342b",
 "generated_by": "docs/architecture_comparison/experiment_package/build_experiment_package.py",
 "not_locked": "Nothing in this package is pre-registered, locked or decided. Every recommendation is PROPOSED for the owner; thresholds not in the RFP are PROPOSED. No score-bearing run may take place before the owner's LOCK-1 and LOCK-2 (lane 25 Sec. 10).",
 "compliance": [
  "no absolute Hall performance from any closure (credible set empty; gate 3 FAIL); no screening candidate as a performance source; no retuning",
  "valve-outlet feed state (lane 16) and compressor bus draw (lane 33) are TBD, never filled",
  "no architecture named as preferred; eliminations only through lane 24's evaluator (none results)",
  "P5 calibration nuisance is never an axis; Hall-closure uncertainty does not reach upstream elements",
  "every number carries a unit, evidence class and source (input pointer or computation), else TBD with its blocking lane or measurement"
 ],
 "inputs": [
  {
   "key": "minexp_draft",
   "path": "docs/architecture_comparison/minimum_decisive_experiment/experiment_draft.json",
   "lane": "lane_25_min_decisive_experiment",
   "sha256": "54b7b00a60134f2d92f2eb5c9fb49f18d23623a566e04a4b7d70325a0e332509"
  },
  {
   "key": "minexp_doc",
   "path": "docs/architecture_comparison/minimum_decisive_experiment/MINIMUM_DECISIVE_EXPERIMENT_DRAFT.md",
   "lane": "lane_25_min_decisive_experiment",
   "sha256": "eadc0dacdf3bfd9260f8f588267445729237fe85a62b51a8d0b85c0817c40af2"
  },
  {
   "key": "minexp_tools",
   "path": "docs/architecture_comparison/minimum_decisive_experiment/minexp_numbers.py",
   "lane": "lane_25_min_decisive_experiment",
   "sha256": "3ee68a28ddd98d25705a58e293944d89dc102b44caad7ac55b912e55fafd7f4b"
  },
  {
   "key": "protocol",
   "path": "docs/architecture_comparison/experiment_protocol/protocol_draft.json",
   "lane": "lane_06_experiment_protocol",
   "sha256": "287dd7ecd57087e46f2f3d786bfb2d64b01ac4fe29a29de21ef98b04c5ac96e3"
  },
  {
   "key": "protocol_doc",
   "path": "docs/architecture_comparison/experiment_protocol/EXPERIMENT_PROTOCOL_DRAFT.md",
   "lane": "lane_06_experiment_protocol",
   "sha256": "8ef5329fb26a0c90d15ae6067c1af81b141b30b95152daf0e5fcff1e4951fb66"
  },
  {
   "key": "failure_tree",
   "path": "docs/architecture_comparison/failure_tree/failure_trees_v1.json",
   "lane": "lane_26_failure_tree",
   "sha256": "5b81c1e99fd7ed9a4fbb4f3e4ef0abda5a753af668ffb20003a3888cb0365d93"
  },
  {
   "key": "overlay_rf",
   "path": "docs/architecture_comparison/overlays/rf/overlay_rf_v1.json",
   "lane": "fo_rf_breakeven_overlay",
   "sha256": "ba739be2fdf431ac33900207cd8365d265456ad7b9d7e6a71e0875524c662359"
  },
  {
   "key": "overlay_ecr",
   "path": "docs/architecture_comparison/overlays/ecr/overlay_ecr_v1.json",
   "lane": "fo_ecr_breakeven_overlay",
   "sha256": "3ee12e66f94204955f61cbb78d7c5036044cc59a9bc50f675704592bfbfabfcd"
  },
  {
   "key": "overlay_hs",
   "path": "docs/architecture_comparison/overlays/hall_sustainment/hall_sustainment_envelope_v1.json",
   "lane": "fo_hall_sustainment_envelope",
   "sha256": "c7d05fd04aafe249ff0dce575902067dea9bdd048fa857283cb66066e612b19e"
  },
  {
   "key": "hg_matrix",
   "path": "docs/architecture_comparison/hard_gates/hard_gate_matrix_v1.json",
   "lane": "lane_24_hard_gates",
   "sha256": "7d77d2831214f3f3d96c8254ea43643ada15e7d1ce0685dec86a65eb79a8f65f"
  },
  {
   "key": "hg_status",
   "path": "docs/architecture_comparison/hard_gates/hard_gate_status_v1.json",
   "lane": "lane_24_hard_gates",
   "sha256": "2c82b3277067b22c85eabd25539b18101f429e6d34ee698d2f5d6e183aa44527"
  },
  {
   "key": "hg_register",
   "path": "docs/architecture_comparison/hard_gates/evidence_register_v1.json",
   "lane": "lane_24_hard_gates",
   "sha256": "45dfbfb311441aeb7c9c58f5dbb9ffb39c28fa448b85de552c37e8268ff94a3d"
  },
  {
   "key": "hg_module",
   "path": "abep_sim/hard_gates.py",
   "lane": "lane_24_hard_gates",
   "sha256": "a36fe3c9065291f0fe5be3f17e179d5b691f00c013f7f8ef299fa89db896dda8"
  },
  {
   "key": "hg_schema",
   "path": "schemas/architecture_comparison/hard_gates_v1.schema.json",
   "lane": "lane_24_hard_gates",
   "sha256": "e5c70c588f3e785720c0d9d01013e5725807b9fd288fa8a1bddf6ba6d86f54ba"
  },
  {
   "key": "arch_boundary",
   "path": "abep_sim/arch_boundary.py",
   "lane": "lane_11_bus_boundary",
   "sha256": "8dfc309a5d2c717913fd4961bc660f8bab92ed2c59356f5a78bff3ef4392eeae"
  },
  {
   "key": "feed_envelope",
   "path": "docs/architecture_comparison/feed_envelope/feed_envelope_v1.json",
   "lane": "lane_16_feed_envelope",
   "sha256": "ada3ee720b1b8d60526d3b092492589f62a4144112845b4d813dbc8dc7d5ca02"
  },
  {
   "key": "constants",
   "path": "abep_sim/constants.py",
   "lane": "repository (RFP record and physical constants; read by minexp_numbers.py)",
   "sha256": "dd1c564324c139471bb361d27ef0f75b0f84de1878d100d4313aed12677f33d7"
  },
  {
   "key": "hall_ensemble",
   "path": "abep_sim/hall_ensemble.py",
   "lane": "repository (admission guard; read by the lane-24 evaluator)",
   "sha256": "218f890c8444af1f593396da5051e38d2d093bbb3cb0bc976cc44b01b67df704"
  },
  {
   "key": "transport_ensemble",
   "path": "hallthruster_bridge/ensemble/transport_ensemble_v0.json",
   "lane": "physics track (transport ensemble; read-only, admitted set empty)",
   "sha256": "2d5069a3382ab667362befeeb5a737261f70a279d19cb89ee79cb61ae35ba08b"
  }
 ],
 "milestones": {
  "supports": [
   "A"
  ],
  "A": {
   "unlocks": [
    "LOCK-1 can be written once the owner decides D-01..D-15 (this package is the decision record)",
    "S1 (qualification) can start; D0 then decides from measured S1 values whether delta is reachable",
    "the measurements in the traceability matrix can move overlay placements from STRADDLES to CLEARLY_ABOVE_BREAKEVEN or CLEARLY_BELOW at the tested hardware point (thresholds carried per entry)",
    "Bundle-1 conditions RF C1/C2/C4, ECR (A)/(B) and HS-A2 become checkable on measured data (partial where the matrix says so)"
   ],
   "does_not": [
    "name a baseline or set any architecture aside",
    "eliminate through lane 24 (outcome templates: point_design scope, n2_surrogate feed)"
   ]
  },
  "to_reach_B": [
   "an admitted Hall transport closure (credible set empty, gate 3 FAIL) to carry the tested-point C*, y and kappa to the Vyovrinda design envelope",
   "O / O2 chemistry and an atomic-O-bearing feed (the bottled surrogate has none)",
   "the valve-outlet feed state (lane 16 design inputs) and the ICD compressor draw (lane 33) for the V1 boundary",
   "the physics-track pre-registration (D-14) if the data are to count as closure evidence",
   "second-lens verification of any single-lens-v1 lane used as decisive evidence"
  ],
  "to_reach_C": [
   "mass, thermal, life, startup, cathode and mission closure on one integrated design; flight-representative PPU and source chains (M-MWCHAIN); endurance on an O-bearing feed (DM-6)"
  ]
 },
 "decisions": [
  {
   "id": "D-01",
   "title": "T-BUDGET-SHARES: allocation of the ln R uncertainty budget over the variance groups G1-G5",
   "source": {
    "lane_25_open_decision": [
     "docs/architecture_comparison/minimum_decisive_experiment/experiment_draft.json#/open_owner_decisions/0"
    ],
    "lane_25_threshold": "T-BUDGET-SHARES",
    "input": "docs/architecture_comparison/minimum_decisive_experiment/experiment_draft.json#/thresholds (id T-BUDGET-SHARES)"
   },
   "status": "OPEN_OWNER_DECISION",
   "structural_finding": "The shares set only the PLANNING targets (instrument and mount specifications). D0 (readiness_n) and scoring use the actual S1 variance components and never the shares (minexp_numbers.readiness_n takes no share argument), so the choice cannot move a classification; it moves what the instruments must achieve before D0 can pass.",
   "options": [
    {
     "id": "D-01-A",
     "label": "equal five-way (lane-25 proposal)",
     "shares": {
      "G1": {
       "value": 0.2,
       "unit": "fraction of sigma_max^2",
       "evidence_class": "assumed",
       "source": "lane-25 proposal: docs/architecture_comparison/minimum_decisive_experiment/experiment_draft.json#/thresholds (id T-BUDGET-SHARES)"
      },
      "G2": {
       "value": 0.2,
       "unit": "fraction of sigma_max^2",
       "evidence_class": "assumed",
       "source": "lane-25 proposal: docs/architecture_comparison/minimum_decisive_experiment/experiment_draft.json#/thresholds (id T-BUDGET-SHARES)"
      },
      "G3": {
       "value": 0.2,
       "unit": "fraction of sigma_max^2",
       "evidence_class": "assumed",
       "source": "lane-25 proposal: docs/architecture_comparison/minimum_decisive_experiment/experiment_draft.json#/thresholds (id T-BUDGET-SHARES)"
      },
      "G4": {
       "value": 0.2,
       "unit": "fraction of sigma_max^2",
       "evidence_class": "assumed",
       "source": "lane-25 proposal: docs/architecture_comparison/minimum_decisive_experiment/experiment_draft.json#/thresholds (id T-BUDGET-SHARES)"
      },
      "G5": {
       "value": 0.2,
       "unit": "fraction of sigma_max^2",
       "evidence_class": "assumed",
       "source": "lane-25 proposal: docs/architecture_comparison/minimum_decisive_experiment/experiment_draft.json#/thresholds (id T-BUDGET-SHARES)"
      }
     },
     "evidence_class": "assumed",
     "consequences": {
      "statistics_and_targets": {
       "4": {
        "nu_eff": {
         "value": 28.846154,
         "unit": "-",
         "evidence_class": "model-derived",